OPPORTUNITY NUMBER,OPPORTUNITY TITLE,AGENCY CODE,OPPORTUNITY STATUS,POSTED DATE,CLOSE DATE
"=HYPERLINK(""https://www.grants.gov/search-results-detail/342288"",""RFI-668-22-ACHIEVE"")","HIV/AIDS Orphans and Vulnerable Children and Adolescent Girls and Young Women Follow On Activity","USAID-SSD","forecasted","07/14/2022",""
"=HYPERLINK(""https://www.grants.gov/search-results-detail/329343"",""RFI-613-21-000001"")","Support to Zimbabwe's Programs for HIV prevention, Care and Treatment","USAID-ZIM","forecasted","10/06/2020",""
"=HYPERLINK(""https://www.grants.gov/search-results-detail/349216"",""72052123RFI00002"")","Sources Sought Notice for HIV Affected Orphans and Vulnerable Children (OVC) and Adolescent Girls and Young Women (AGYW)","USAID-HAI","forecasted","07/12/2023",""
"=HYPERLINK(""https://www.grants.gov/search-results-detail/330535"",""720-621-21-RFI-00001"")","RFI - Orphans and Vulnerable Children (OVC) Next Generation, Tanzania","USAID-TAN","forecasted","12/21/2020",""
"=HYPERLINK(""https://www.grants.gov/search-results-detail/348036"",""72067423RFI00004"")","Draft Notice of Funding Opportunity - Children, Adolescents, and Families in the HIV Epidemic in Limpopo Province","USAID-SAF","forecasted","05/10/2023",""
"=HYPERLINK(""https://www.grants.gov/search-results-detail/347106"",""RFI-2023-OVC-NW"")","Children, Adolescents & Families in the HIV Epidemic in the North West Province","USAID-SAF","forecasted","03/24/2023",""
"=HYPERLINK(""https://www.grants.gov/search-results-detail/343653"",""W81XWH-22-DHAPP"")","Department of Defense HIV/AIDS Prevention Program","DOD-AMRAA","posted","09/19/2022","09/18/2027"
"=HYPERLINK(""https://www.grants.gov/search-results-detail/343877"",""RFI-265-0922"")","Request for Information for USAID/Malawi VMMC Service  Delivery Provision Activity","USAID-MLW","forecasted","10/03/2022",""
"=HYPERLINK(""https://www.grants.gov/search-results-detail/330125"",""RFI-GH-21-002"")","PROPEL Health Project (Promoting Results and Outcomes through Policy and Economic Levers)","USAID","forecasted","11/30/2020",""
"=HYPERLINK(""https://www.grants.gov/search-results-detail/351422"",""72067424RFA00001"")","Health Financing and Public Financial Management Systems Strengthening Activity in South Africa","USAID-SAF","forecasted","12/11/2023",""
"=HYPERLINK(""https://www.grants.gov/search-results-detail/352303"",""720674RFA00006"")","USAID/Lesotho Bophelo Bo Botle (Good Health) Activity","USAID-SAF","forecasted","02/12/2024",""