OPPORTUNITY NUMBER,OPPORTUNITY TITLE,AGENCY CODE,OPPORTUNITY STATUS,POSTED DATE,CLOSE DATE
"=HYPERLINK(""https://www.grants.gov/search-results-detail/351759"",""72049724RFI00002"")","Health System Strengthening (HSS) Flagship Activity in Indonesia","USAID-IND","forecasted","01/10/2024",""
"=HYPERLINK(""https://www.grants.gov/search-results-detail/355486"",""CDC-RFA-JG-25-0092"")","Strengthening comprehensive HIV and TB services and health systems in high-burden areas of Namibia under the President's Emergency Plan for AIDS Relief (PEPFAR)","HHS-CDC-GHC","forecasted","07/18/2024",""
"=HYPERLINK(""https://www.grants.gov/search-results-detail/355659"",""CDC-RFA-JG-25-0094"")","Capacity building, technical assistance and workforce training to rapidly and effectively address health threats and to accelerate the response to HIV in the United Republic of Tanzania under the President's Emergency Plan for AIDS Relief (PEPFAR)","HHS-CDC-GHC","forecasted","07/25/2024",""
"=HYPERLINK(""https://www.grants.gov/search-results-detail/355655"",""CDC-RFA-JG-25-0062"")","Providing targeted technical assistance to the HIV/TB prevention-care-treatment continuum using cost efficient and scalable quality improvement approaches to address program gaps in support of sustainable HIV services in Zambia under PEPFAR","HHS-CDC-GHC","forecasted","07/25/2024",""
"=HYPERLINK(""https://www.grants.gov/search-results-detail/355446"",""CDC-RFA-JG-25-0049"")","Human resources for health (HRH) to achieve and sustain TB/HIV epidemic control in Malawi under the President's Emergency Plan for AIDS Relief (PEPFAR)","HHS-CDC-GHC","forecasted","07/17/2024",""
"=HYPERLINK(""https://www.grants.gov/search-results-detail/328144"",""RFI-685-20-IHSHCS-01"")","Improving Health Status and Human Capital in Senegal Activity","USAID-SEN","forecasted","07/17/2020",""
"=HYPERLINK(""https://www.grants.gov/search-results-detail/349656"",""72049223APS00001"")","UNIVERSAL HEALTH CARE PROJECT APS","USAID-PHI","posted","08/01/2023","07/31/2025"
"=HYPERLINK(""https://www.grants.gov/search-results-detail/356671"",""72062024RFA00009"")","USAID Primary Health Care Improvement Program (UPHIP)","USAID-NIG","posted","10/09/2024","11/15/2024"
"=HYPERLINK(""https://www.grants.gov/search-results-detail/342948"",""72049222-OH-SSN-00001"")","USAID/Philippines Integrated Health Project","USAID-PHI","forecasted","08/04/2022",""
"=HYPERLINK(""https://www.grants.gov/search-results-detail/343101"",""RFI-674-22-SAHEALTHFINANCINGACTIVITY"")","South Africa Health Financing Activity","USAID-SAF","forecasted","08/12/2022",""
"=HYPERLINK(""https://www.grants.gov/search-results-detail/328814"",""RFI-278-20-HSQA"")","Health Service Quality Accelerator","USAID-JOR","forecasted","08/27/2020",""
"=HYPERLINK(""https://www.grants.gov/search-results-detail/356858"",""DFOP0016988"")","Build Partner Capabilities to Protect Critical Advanced and Emerging Technologies","DOS-ISN","posted","10/26/2024","01/17/2025"
"=HYPERLINK(""https://www.grants.gov/search-results-detail/356864"",""DFOP0016986"")","Advancing Nuclear Safety, Security, and Nonproliferation through the FIRST Program","DOS-ISN","posted","10/26/2024","01/17/2025"
"=HYPERLINK(""https://www.grants.gov/search-results-detail/356866"",""DFOP0016992"")","Build Partner Capabilities to Counter the Russian Federation’s Chemical and Biological Threats","DOS-ISN","posted","10/26/2024","01/17/2025"
"=HYPERLINK(""https://www.grants.gov/search-results-detail/356857"",""DFOP0016984"")","Build Partner Resilience to Counter Proliferator State Hybrid Threats in the Nonproliferation Arena","DOS-ISN","posted","10/26/2024","01/17/2025"
"=HYPERLINK(""https://www.grants.gov/search-results-detail/356862"",""DFOP0016991"")","Countering WMD and UAS Threats in Iraq","DOS-ISN","posted","10/26/2024","01/17/2025"
"=HYPERLINK(""https://www.grants.gov/search-results-detail/356867"",""DFOP0016994"")","Nonproliferation Scientist Engagement Program","DOS-ISN","posted","10/26/2024","01/17/2025"
"=HYPERLINK(""https://www.grants.gov/search-results-detail/356860"",""DFOP0016985"")","Countering Proliferator State Advanced Conventional Weapons Proliferation","DOS-ISN","posted","10/26/2024","01/17/2025"
"=HYPERLINK(""https://www.grants.gov/search-results-detail/356863"",""DFOP0016993"")","Countering the Russian Federation’s Sanctions Evasion Activities","DOS-ISN","posted","10/26/2024","01/17/2025"
"=HYPERLINK(""https://www.grants.gov/search-results-detail/356859"",""DFOP0016989"")","Build Partner Capabilities to Counter Global Biological Threats","DOS-ISN","posted","10/26/2024","01/17/2025"
"=HYPERLINK(""https://www.grants.gov/search-results-detail/356856"",""DFOP0016987"")","Build Partner Capabilities to Protect Semiconductor and CHIPS Technology","DOS-ISN","posted","10/25/2024","01/17/2025"
"=HYPERLINK(""https://www.grants.gov/search-results-detail/356861"",""DFOP0016990"")","Building Partner Capacity to Counter Chemical Weapons Threats","DOS-ISN","posted","10/26/2024","01/17/2025"
"=HYPERLINK(""https://www.grants.gov/search-results-detail/356865"",""DFOP0016995"")","Countering DPRK and Iran’s WMD, UAS, and Missile Proliferation","DOS-ISN","posted","10/26/2024","01/17/2025"
"=HYPERLINK(""https://www.grants.gov/search-results-detail/350293"",""RFI7200AA23RFI00014"")","Accelerating ChoiCe, Equity, and Sustainability for Services","USAID","forecasted","09/22/2023",""
"=HYPERLINK(""https://www.grants.gov/search-results-detail/338128"",""72067522APS00002"")","Guinea Local Health System Strengthening (GLHSS)","USAID-GUI","posted","02/16/2022","02/25/2025"
"=HYPERLINK(""https://www.grants.gov/search-results-detail/331378"",""HSS-RFI-615-21-000001"")","Request for Information_USAID|Kenya and East Africa/ Health Systems Strengthening (HSS) Project_Redesign","USAID-KEN","forecasted","02/08/2021",""
"=HYPERLINK(""https://www.grants.gov/search-results-detail/351422"",""72067424RFA00001"")","Health Financing and Public Financial Management Systems Strengthening Activity in South Africa","USAID-SAF","forecasted","12/11/2023",""
"=HYPERLINK(""https://www.grants.gov/search-results-detail/352469"",""7200AA2400010"")","USAID Integrated Health Systems Strengthening Activity (IHSS) - RFI #2","USAID","forecasted","02/15/2024",""
"=HYPERLINK(""https://www.grants.gov/search-results-detail/343653"",""W81XWH-22-DHAPP"")","Department of Defense HIV/AIDS Prevention Program","DOD-AMRAA","posted","09/19/2022","09/18/2027"
"=HYPERLINK(""https://www.grants.gov/search-results-detail/356643"",""72068724RFA00007"")","USAID Access Miahy","USAID-MAD","posted","10/07/2024","11/27/2024"
"=HYPERLINK(""https://www.grants.gov/search-results-detail/356660"",""72068724RFA00008"")","USAID Access Miahy","USAID-MAD","posted","10/08/2024","11/27/2024"
"=HYPERLINK(""https://www.grants.gov/search-results-detail/354472"",""72069524RFA00004"")","Notice of Funding Opportunity for Kira Ukuze Activity","USAID-BUR","forecasted","05/28/2024",""
"=HYPERLINK(""https://www.grants.gov/search-results-detail/356827"",""72048225RFA00002"")","Strengthening Malaria Control for High-Risk Communities","USAID-THA","posted","10/24/2024","12/06/2024"
"=HYPERLINK(""https://www.grants.gov/search-results-detail/347106"",""RFI-2023-OVC-NW"")","Children, Adolescents & Families in the HIV Epidemic in the North West Province","USAID-SAF","forecasted","03/24/2023",""
"=HYPERLINK(""https://www.grants.gov/search-results-detail/352303"",""720674RFA00006"")","USAID/Lesotho Bophelo Bo Botle (Good Health) Activity","USAID-SAF","forecasted","02/12/2024",""
"=HYPERLINK(""https://www.grants.gov/search-results-detail/348036"",""72067423RFI00004"")","Draft Notice of Funding Opportunity - Children, Adolescents, and Families in the HIV Epidemic in Limpopo Province","USAID-SAF","forecasted","05/10/2023",""
"=HYPERLINK(""https://www.grants.gov/search-results-detail/356434"",""72066024RFA00006"")","USAID Accelerator Activity","USAID-DEM","posted","09/17/2024","10/30/2024"
"=HYPERLINK(""https://www.grants.gov/search-results-detail/169154"",""RFA-674-12-000005"")","Comprehensive District-Based Support for Better HIV/TB Patient Outcomes","USAID-SAF","posted","05/04/2012",""
"=HYPERLINK(""https://www.grants.gov/search-results-detail/330125"",""RFI-GH-21-002"")","PROPEL Health Project (Promoting Results and Outcomes through Policy and Economic Levers)","USAID","forecasted","11/30/2020",""
"=HYPERLINK(""https://www.grants.gov/search-results-detail/356165"",""72068524RFA00017"")","USAID Burkina Faso Community Health Activity","USAID-SEN","posted","08/22/2024","11/08/2024"
"=HYPERLINK(""https://www.grants.gov/search-results-detail/228973"",""RFA-391-13-000009"")","Child, Newborn, and Maternal Health Project","USAID-PAK","posted","04/03/2013",""
"=HYPERLINK(""https://www.grants.gov/search-results-detail/275168"",""SOL-OAA-15-000054"")","Annual Program Statement - Policy, Advocacy, and Communication Enhanced  for Population and Reproductive Health (PACE)","USAID","posted","03/13/2015","03/12/2025"
"=HYPERLINK(""https://www.grants.gov/search-results-detail/312434"",""7200AA19APS00001"")","Local Organizations Network Project (LON)","USAID","posted","01/29/2019","09/28/2029"
"=HYPERLINK(""https://www.grants.gov/search-results-detail/315120"",""7200AA19APS00002"")","MOMENTUM (Moving Integrated, Quality Maternal, Newborn, and Child Health Services, Voluntary Family Planning, and Reproductive Health Care [MNCH/FP/RH] to Scale)","USAID","posted","04/22/2019","09/30/2025"